Name,Role,Designation,Contact No,Email
Dr. Dhiren P. Shah,Chairperson,Principal,9427474602,dhiren.shah@ckpipsr.ac.in
Dr. Vinod D. Ramani,Coordinator,Associate Professor,9913792913,vinod.ramani@ckpipsr.ac.in
Mr. Yash D. Dudhwala ,Member, Assistant Professor,9033080481,yash.dudhwala@ckpipsr.ac.in
Mr. Yahya A. Moolla,Member,Assistant Professor,7201932423,yahya.moolla @ckpipsr.ac.in
Ms. Kinjal S. Gamit,Member,Assistant Professor,9687198278,kinjal.gamit@ckpipsr.ac.in
Mrs. Hema V. Badgujar,Member,Assistant Professor,8320770687,hema.kamalja@ckpipsr.ac.in